categoria,review
-1,"temos que usar né, mais esta ruim pq qd vc faz transferência ou paga boleto fica so aparecendo msg falando "" pra aguardar enquanto o comprovante e gerado e nunca gera"" entt se vc quiser o comprovante do que vc transferiu ou pagou tem que ir ate o banco."
-1,"Aplicativo não é ruim ,mas o banco é um lixo"
-1,Depois que atualizei o apricativo não conseguir abrir de jeito nenhum. Uma vergonha!
-1,"Era 5 estrelas, mas depois da última atualização ficou péssimo. conseguiram destruir o melhor app de banco. não dá pra transferir dinheiro da poupança pra corrente, os lançamentos não aparecem agregaram algumas funções tá horrível. vamos ajeitar esse negócio que tá ruim demais."
-1,"Erro console Não sei o que ocorre, para de funcionar sozinho e tenho que reinstalar. No mais é ótimo."
-1,"Pago minhas contas onde eu estiver dou mil estrelas, mal vou ao banco"
-1,"Não funciona direito, não consigo fazer loggin com minha conta e de quebra ainda bloqueou minha senha pqp"
-1,"Aplicativo nojento e detestável que não funciona pra nada. Cheio de bugs e erros. Acho que Quando um aplicativo aplicativo tem um desempenho igual a esse nível horrível, não deveria nem estar disponível na playstore. Se for fazer um aplicativo faz direito. Já entrei mil vezes nesse aplicativo e nunca consegui acessar pq tem hora que nem o teclado numérico aparece. Só não sou 0 pq não tem a opção."
-1,Ficou muito ruim...não abre
-1,"Funcional, aqui ali esbarro numa limitação que não encontrei em outros aplicativos de outros bancos, mas funciona. Tem melhorado muito nos últimos meses. Agora por exemplo tem a opção de entrar com a biometria, o que dificulta muito quaisquer risco de fraudes. Claro que pra usar este recurso seu celular tem que dispor da tecnologia. Também gostei dos gráficos gerados a partir do extrato condensando e agrupando despesas por tipo, boletos, restaurantes, gasolina, saques, farmácia e etc. Por tudo isso aumentei mais uma estrela na minha avalição."
-1,"App bugando e fechando sozinho, suporte solicitado e sem retorno, atendimento precisa melhorar muito. Me sinto muito insatisfeita."
-1,até agora não me decepcionou
-1,"o q fizeram cm o app??? Não tem como ver quanto tem na conta salário! Voltem a versão antiga, por favor! Ficou horrível essa atualização!"
-1,"Trava muito e às vezes não é muito prático. Dá bastante erro nas movimentações. Fora isso, tudo ok."
-1,Galaxy S5... cagou tudo... trava... nao entra... fecha... ficou um.lixo
-1,Só ajudaria facilitar o desbloqueio pra quem errou a senha! E não tem cartão ainda... Tem q haver soluções pra todas situações
-1,"Pelo amor de Deus, o que vocês fizeram com esse App? ficou horrível muito mais difícil de usar! onde está a opção de saldo da poupança ?"
-1,"Essa atualização só trouxe dor de cabeça. Antes era um dos melhores e mais práticos apps, hoje em dia tá muito ruim... não consigo fazer simulações... os depósitos programados na versão anterior foram quase todos cancelados... tá péssimo para fazer transferências e resgates. Voltem à versão anterior!"
-1,Meu App BBB não quer pega no tablet mais pq ? Que raiva do Caraí 😤
-1,"O App é bom, mais o seguro do carro que pago um absurdo!!!!! Não condiz pelo que pago só passei raiva quando precisei"
-1,"Prefiro s versão anterior, muito ruim essa😡"
-1,"Odiei essa nova atualização, o leitor de códigos de barra não funciona mais! antes conseguia pagar as contas sem problema. agora é esse estresse. Por favor melhorem!!! ou voltem a configuração antiga que funcionava perfeitamente. Odiei! nada prático!"
-1,"não gostei, mais complicado que o anterior, visualização ruim"
-1,Fila de banco nunca mais
-1,"O app é bom mas muitas opções, especialmente aquelas fazem o banco perder dinheiro (e você ganhar), como por exemplo a opção de desativar pacote de serviços, que só podem ser acessadas no caixa eletrônico, o que têm se tornado cada vez mais difícil por conta da substituição dos mesmos por caixas 24h"
-1,"Para quem tem a conta, com app fica tudo mais fácil e vc não precisa ir ao banco que é uma merda pq no banco tudo lá dentro e lerdo e não funciona nada com agente quer e ossso."
-1,Continua ruim Muito ruim no primeiro problema não funciona mais e não possui uma central a qual possa se recorrer muito ruim mesmo é mais fácil trocar de banco do que esperar uma solução
-1,"muito ruim mesmo, para dar certo so indo a uma agencia"
-1,muito ruim nao acessa a conta fica so volta na pagina da senha raramente carega a pagina do banco a outra versao era excelente
-1,Jamais indica ese app pedi 1 cartao agora pra consuta o andamento da propoata. So aiatema disponivel erro s 500 comi que ter cliente um banco dese
-1,"Uma droga! Fica um ponto de exclamação vermelho no campo CPF, não aparece os números ao digitar, não tem como utilizar o app."
-1,Difícil ser feliz com esse banco. Mudei de celular e reinstalei. Virou um saco.
-1,"Não estou conseguindo acessar minha conta, so está dando erro. Os servidores podem me dizer o que esta acontecendo ? Gosto do aplicativo, mais assim não dá, já que preciso entrar na conta e não consigo. Me ajudem. Please!!"
-1,Nota 0 Uma M....! Toda hora trava e depois que aderi ao BB Code piorou! Quase todo dia da erro e tenho que desinstalar e instalar novamente o aplivativo e recomeçar os passos de cadastramento do BB Code. Fico sem poder fazer as movimentações pela internet pois o segundo passo tem que ser feito nos terminais de auto atendimento para liberar o BB Code. Pra piorar o 0800 de suporte tecnico não resolveu meu problema e pediu 72 horas para responder!
-1,"A cada atualização está pior. Trava, fica lento e não finaliza as operações. Está horrível pra usar."
-1,"Não é intuitivo e não tem várias funcionalidades que diz que tem. Sempre que tento algo mais complexo do que uma simples transferência, dá vários erros e me manda procurar uma agência. Faço tudo pelo computador que é mais rápido, não trava e as informações são menos confusas. Se você já usa o computador para os serviços online, esse aplicativo só vai te fazer perder tempo e complicar a vida."
-1,"Não funciona essa merda, pura enganação."
-1,"Horrível!! O App não abre,fica só carregando"
-1,Ta uma bosta fica carregando e não abre função nenhuma. Conto com o aplicativo pra pagar meus boletos e já estão atrasando por causa dessa bosta
-1,"Boa experiência, porém se vc tem mais de uma conta, não consegue ativar o token pra duas. Ocorre erro."
-1,"Já vi aplicativo mal otimizado, mas esse do BB está em outro nível, toda hora ele da erro e fecha.Quando ler o código de barra ele sempre coloca o pagamento pro dia do vencimento e função de cancelar lançamentos futuros está presente mas nunca funcionou."
-1,"A versao anterior atendia muito bem as minhas necessidades com rapidez e praticidade, agora depois dessa atualização esta horrível parece ate um caca palavras encontrar o que preciso fazer uma droga literalmente"
-1,"Na maioria das vezes que vou logar, dá erro no servidor, no DNS. Uma porcaria, não me atende em nada!"
-1,Não gostei achei mais difícil pra mexer
-1,"Muito Bom, resolvo tudo por aqui, é cômodo pra mim, porém toda hora da erro na minha senha e acaba bloqueando, aí preciso ir direto na agência quase sempre para efetuar o desbloqueio"
-1,Toda vez que atualiza tem que reativar o BBCode no caixa eletrônico. Isso enche o saco.
-1,"Muito útil, mas quando tive que cadastrar uma senha de 8 dígitos para entrar em outra conta não consegui, sempre dá erro. Mudem isso!!! Mas entre outros atendimento e uso da minha conta é excelente!"
-1,"Era perfeito! Tudo era leve, prático, intuitivo e funcional. Agora tá denso, carregado, pesado, visualmente cansativo, até o acesso ao menu ficou mais difícil. Aqueles cards gigantes como Transferências, Movimentação financeira, Cartões e Orçamento na tela inicial ficaram muito feios, além de serem totalmente disfuncionais e sem nexo. Aguardando os ajustes."
-1,Comparado com o do Bradesco o APP é horrível
-1,ta ruim pois a data para pagamentos transferência nao modifica muito ruim
-1,"O aplicativo é muito útil, principalmente para quem não tem tempo e leva uma vida atribulada. O único ponto negativo é o leitor de código de barras, que tem muita dificuldade em capturar o código. Apesar que já está na hora de mudar o padrão linear já está ultrapassado. O QR code é o substituto natural."
-1,Pior aplicativo de Banco que ja usei uma bosta toda hora trava.
-1,Muito bom mas tem dificuldade em fazer pagamentos
-1,Estava usando normalmente só que de um tempo pra cá fica só dando erro na dns e não To conseguindo mais usar ele já desinstalei e reinstale e nada até agora
-1,"Este sistema é ótimo mas dá um erro atrás do outro! Demora séculos para carregar!!! E qd carrega, trava! Não adianta ter um.monte de funcionalidade e não funcionar!!!"
-1,"Esse app não abre conta nem lascando, muito ruim. Corrijam isso"
-1,"Ta dando erro após fazer o login, não da pra acessar nada, melhorem isso ai!"
-1,ruim. Não se usar. terei de ir na agência
-1,"Uma bosta! Sempre com problema na conexão, mesmo com perfil gravado diz agência invalida, quando finalmente abre a conta, não mostra valores pq só aparece inválidos. Realmente problemático."
-1,É horrivel eu nao consigo entrar pedindo uma caraio de senha de 8 digitos q nao tem o meu é somente letras
-1,"Horrível, quase toda vez que tento entrar ele da erro. A pior coisa que fizeram foi mudar pra essa versão."
-1,Quem não consegue usar ou tem problemas é porque o celular é ruim mesmo! Hoje faço tudo por este app
-1,"O aplicativo tá horrível.. não entra, da problema.. péssimo!"
-1,"Eu ja tentei entrar uma centena de veses hoje e nao consigo. Ja desinstalei e estou baixando novamente. Tá horrível! Deveria ter opção para adiantar pagamentos de empréstimo, desbloquear cartão e cancelar serviços, como por exemplo Seguro de vida. Perdemos um dia inteiro na fila do Banco com coisas tão simples!"
-1,"Não consigo usar o saque móvel, aplicativo da erro, pra mim não serve."
-1,"A última atualização ficou PÉSSIMA preferia o antigo era muito mais leve, sem contar que não consigo acessar o aplicativo pelo Wifi somente por DADOS MÓVEIS! Muito ruim essa versão, também achei as informações confusas! Comk extrato, extrato do cartão etc!"
-1,Este app não funciona infelizmente tenho conta do banco do Brasil e estou sinceramente querendo encerra as respostas aqui só são automáticas lixo total uma falta de respeito com os usuários
-1,O banco como App e uma droga
-1,O problema esta no banco que pessimo.o atendimento eh muito ruim.os atendentes nao ti atende bem e ainda sao ingnorante
-1,"Muito ruim! Pouco informação, nem codigo de barras consigo retirar."
-1,"É muito bom de usar, mais na hora de completar a conta com dados pessoais a gente encontra muita dificuldade!!!!"
-1,"Não consigo fazer transferência nem pagar boletos, será q é porque eu só tenho conta poupança? Gostaria de saber pois algumas pessoas me falaram que mesmo não tendo conta corrente eu poderia fazer essas transações. Estou chateada pois o aplicativo me ajudaria muito."
-1,Fui bastante maltratado dentro da agência
-1,Ex: o app deveria ter a opção de bloquear o cartão em caso de perda ou roubo e a opção de solicitar um novo cartão. Mas para bloquear o meu cartão tive que ligar na central de atendimento e esperar 40 minutos. Se estivesse esse recurso seria muito bom.
-1,preciso de mais opcoes e tenho que ir na agencia ai e ruim
-1,"Péssimo aplicativo, péssimo banco, não confiem nos conselhos de investimento quando te telefonarem, esse Brasilprev tem uma taxação muito alta no imposto de renda, não caiam nessa furada. Fora as ofertas de planos de capitalização e outros ""investimentos"" bons apenas pro banco. Acabei de achar um lançamento suspeito numa compra onde sequer consta o nome do local onda a compra foi feita, não há botão ou opção para contestar."
-1,app mto bom..mas agora nao consigo acessa porque fala que mimha senha foi bloqueada do nada...lamentavel
-1,Não tô conseguindo trocar minha senha de 8 dígitos tá horrível isso acabei esquecendo a senha é não estou conseguindo mudar pfv BB né ajuda aí .😑
-1,olha não consigo nem fazer contato com o banco muito ruim o.aplicativo desculpa a franqueza
-1,Muito prático rápido não é difícil de fazer transferência entre outros muito bom recomendo
-1,"Não salva os comprovantes...""espere enquanto o seu comprovante é gerado"" mensagem chata, e mesmo esperando, continua com o problema."
-1,Depois dessa ultima atualizaçao ficou horrivel...
-1,É dificil não. consegui ver minha fatura paga
-1,"O aplicativo é nota 9.5 para ser 10 só falto ter a opção de fazer provisionamento de saque, pois foi a única função que não localizei no aplicativo, pois é muito ruim ter que ir até uma agência preencher o provisionamento manual"
-1,app antes era muito bom agora depois que atualizou ficou ruim !!!
-1,"Não consigo fazer login, fica só carregando convertem a droga desse aplicativo !!!!"
-1,cada dia só piora. App lixo depois da última atualização ficou ainda mais ruim.
-1,"Manutenção muito cara no Itaú pago 2 meses e aqui somente 1, falou na hora q a conta ia ter várias coisas não tem nada vou cancelar minha conta o Itaú sou cliente a 11 anos nunca tiver nada a reclamar o BB q sujar a grana se tivesse como não dá estrela nenhuma eu daria pq é lixo !!!"
-1,"O programa não decepciona, sempre que mudo de celular faço questão de cadastrar o dispositivo móvel, pra ter essa liberdade de fazer transações a qualquer hora e em qualquer lugar. Melhor app, sempre com extratos atualizados e transações praticamente em tempo real."
-1,"Eu Brasilio Gomes de Moraes Neto celular número+5519 99779 6741(eu tenho uma poupança é pouco mais vô movimentar, no momento tô sem cartão eu tô esperando , não posso avaliar , porque tá ruim,,,, já foi melhor, hoje ta muito ruim..."
-1,"Cadê o menu lateral esquerdo deste app. Só aparece a opção configurações, que atualização mais horrível!!!"
-1,"pra ficar melhor precisaria colocar a opção de acompanhamento da fatura detalhada do cartão empresarial... é horrível nao ter acesso a ela... na palma da mão, como tenho em outros bancos! vale a pena vcs reverem isso. grata"
-1,"Funcionava muito bem, agora da erro na hora do que code"
-1,"foi pessima para configurar o uso da digital, precisei ir a una agebcia fisica e mesmo os funcionários do banco tiveram muita dificuldade em auxiliar nessa validação ! Além disso , tbm tive dificuldade em fazer operação de câmbio , pois a agência de escolha , apesar de ter operação de câmbio fisicamente, não rstava na lista do aplicativo ! prefiro retirar o dinheiro ba agência e não em caixas eletrônicos, sempre que possível ! Já tinha ressalvas em colocar o aplicativo no celular.."
-1,"O aplicativo so existe para dar erro, tudo o que faz é "" OPA "", nada funciona, HORRÍVEL"
-1,aplicativo muito ruim não é mais possível ver o limite do cartão de crédito o antigo era muito melhor
-1,"Era um bom aplicativo, mas, ultimamente, está horrível: lento, trava e muitas vezes sequer inicia."
-1,"Era ótimo. Porém, depois da última atualização não abre mais. Melhorem isso, está horrível!"
-1,"Péssimo, é como viver o próprio inferno na terra! Eu não tenho palavras para descrever minha frustração ao tentar habilitar o celular para uso."
-1,"Esta horrível na versão mais atual do Android no Moto Z Play. Tamanho de fontes desproporcional, app parando de funcionar toda hora!"
-1,nao gostei ficou muito mais dificil de utiliza
-1,Não gostei. Pra quem tem deficiência visual ficou horrível. Quando se quer visualizar o extrato está só em meia tela do celular. O restante do espaço ficou encoberto com dados que podiam ficar minimizados ou melhor agrupado sem perder o espaço de visualização. O app antigo era muito melhor. Quero voltar prô antigo. Bem ruim esse.
-1,"Muito bom, porém o BB ainda tem muitos erros de boletos emitidos até por ele mesmo que não aceitam o desconto descrito. Além disso, o app precisava de informações de caixas eletrônicos e agências próximas principalmente pra quem viaja bastante como eu seria fundamental!"
-1,Essa última versão está horrível
-1,"Se arrependimento matasse, eu estaria morto! Até hoje não entendo porque mesmo foi que eu abri uma conta nesse maldito banco! O aplicativo, que deveria ajudar, é praticamente inútil, já que você depende de ir até uma agência para poder acessar certas funções e outras, quando funcionam, exigem validação num caixa automático. Uma piada! Isso sem falar no leitor de digital, que desconfigura cada vez que você sai desse aplicativo lixo!Banco de verdade com aplicativo simples e que funciona de verdade é o Bradesco!"
-1,"Essa nova versão ficou horrível, principalmente o leyout para fazer transferências! Está extremamente confuso manejar transferência da própria conta entre poupança e conta corrente! o leyout antigo era infinitamente melhor que o atual!"
-1,"Não conheço outros bancos , mas com o BB e esse app me sinto muito seguro , não tenho do que reclamar ."
-1,"Não tendo do que reclamar, faz tudo que preciso!"
-1,"Não tenho conseguido acessar minha conta através do aplicativo já faz alguns dias. Hoje, 07/12, tentei 3 vezes conversar pelo telefone e TB não consegui. Que decepção! São ótimos pra cobrar tarifas, mas prestar um serviço bacana, parece que está difícil. Atualizem o aplicativo depressa!!!"
-1,"O aplicativo pega seus dados,mas não finaliza a abertura da conta, fica dando erro, muito suspeito"
-1,"Galera da TI , agiliza ae o aplicativo não tah funcionando .... não consigo fazendo nada ..apenas carregando a da erro...=("
-1,"Só pq minha conta é poupança, eu só posso fazer transferências para o mesmo BB não posso fazer para outro Banco. Muito chato isso."
-1,"Odiei esse App, não abre nada! Bem diz o valor correto das coisas!"
-1,"aplicativo mais complicado, não consigo achar o que preciso, fico indo e voltando sem retorno do estou procurando. opções precisam ser claras de algumas operações. Não estou satisfeita. A toda troca de informações tem que digitar senha, impossível,chato, retrogrado. Não consigo saber quanto foi depositado na minha conta salário, nem extrato, somente saldo e na transferência para contra corrente tenho que colocar os dados da conta, como assim é a mesma conta... muito complicado ..."
-1,Nova versão é horrivel
-1,Não consigo pagar boleto. Não nós é avisando se o sistema está com dificuldades ou algo do tipo!
-1,horrível vc não consegue saber todas as informações
-1,"Por vezes o acesso por biometria não funciona. O que era pra ser algo prático e rápido se torna chato e irritante. Tem que rever isso aí. Aparentemente a questão da biometria foi resolvida, mas essa semana eu tive um problema com uma notificação que não sumia de jeito nenhum e só consegui resolver desinstalando e reinstalando o app."
-1,"Ficaria melhor se tivesse um chat para falar com vcs por aqui mesmo, pq ligar acaba com os créditos, e no 0800 é só com fixo, aí fica ruim, dei entrada no pedido do meu cartão Saraiva, foi aprovado mas desde de o dia 22/08 e até agora nada nem um cód de rastreamento. Não consigo entrar em contato com vcs, melhorem isso, por favor"
-1,"merda,so carrega e nao abre quando é preciso."
-1,"Várias funções importantes que se tem no bankline pelo navegador, não são disponíveis no aplicativo, o que limita seu uso e causa frustração aos usuários em diversas situações."
-1,Pouco intuitivo. Fonte muito pequena. Botões de ação mal posicionados.
-1,"Não consigo abrir uma conta pelo aplicativo, digito certo o meu endereço mas só dá erro no bairro,... Nunca vi isso!!!"
-1,"Faço quase todas as operações por aqui. Praticidade, facilidade sem perda de tempo."
-1,Uma bosta !!
-1,Resolve minha vida!! Só falta sair dinheiro no celular.... Kkkk porém agora está dando erro s503 e não consigo pagar boletos
-1,"Eu imagino que nem mesmo eles utilizam o App. Vc salva uma transferência nos favoritos e quando vai usá-la recebe o erro G999-511 (cod. S500) Cheio de ""funcionalidade"" e o que realmente importa e ajuda não funciona! Acho Burbank muito melhor!"
-1,App bugado não conecta... Só passa raiva...
-1,O mais importante não aparece da erro!!
-1,"Ridículo , fazem o aprovisionamento do saldo e não colocam informações do porque o valor está aprovisionado"
-1,"Meu Deus, esse banco rouba mais que tudo, eu não sabia que até extrato tirado pelo aplicativo e coisas simples que fazia pelo aplicativo era cobrado fora do valor que já desconta todo mês, estão descontando valores absurdos da minha conta, não estou tendo sossego com isso, já desinstalei essa droga pra não perder mais dinheiro com esse banco ladrao."
-1,Uma merda esse merda!!! Atualizei e parou d funcionar o app no meu cel. Que pourro vcs fizeram vei!!??
-1,"ficou péssimo voltem com o antigo,tantas reclamações...Será que não estão vendo a insatisfação do cliente.!Tem outra opção de aplicativo?Não é por costume mas sim por facilidade, pelo amor horrível 😤"
-1,"Só a questão de ter que ir no banco para autorizar a senha para fazer transferência entre outros que é chato, temos que perder mais de hora em fila aguardando pra liberar uma senha."
-1,"Funciona, porém a própria política do BB dificulta, já que para habilitar certas funções precisa ir a agência. Ou seja, dificulta a facilidade do App."
-1,"O banco é uma merda, cheio de enroladores e despreparados, mas o aplicativo funciona."
-1,"Ficou horrível, prefiro o antigo, deveriam ao menos nos consultar, não dá."
-1,da empresa e você 34dias fazendo 4fazen vamos dizer assim tá ruim na saúde foi mesmo para a gente foi um do aniversário da sua casa hoje 4é 4de me esqueça de mim agora há pouco rsrs 4empresa Nubdis🙏o me..
-1,péssimo o anterior era menos complicado
-1,"Como um aplicativo de suma importância não tem o campo de pagamento de IPVA de Sp? Estou muito decepcionada, achei que ia ter praticidade mas no final terei que ir em uma agência 🤦"
-1,"Não estou conseguindo fazer opgrad de conta envio a conta e na hora de colocar a senha trava. Porque limitar uma conta com valor de 500 reais isso é ridículo,se soubesse tinha ido no banco"
-1,Não estava muito confiante que seria fácil abrir a conta como demonstra no comercial contudo foi muita fácil e rápido a abertura de conta pelo app vou testar o aplicativo e se for bom aumento a nota
-1,"Não gostei da última atualização, não mostra tudo como na versão anterior.quero saber se posso voltar a utilizar a versão anterior? Ficou péssimo pra visualizar a poupança,tive que ir ao cx eletrônico pra fazer uma transferência . Não gostei.Alias detestei, já liguei pro atendimento e reclamei."
-1,Muita informação desnecessária e mal organizada
-1,Mudou ficou ruim nao consigo ver meu saldo conta salário.
-1,"vocês estragaram o App, era excelente agora está uma gosta. por favor. ajeitem isso ! está horrível."
-1,Ruim Não consego acesar a minha conta salário precisa melhorar ok
-1,Já fui várias vezes no banco pra autoriza fazer transferência pela aplicativo e só é perda de tempo sempre da erro no sistema não indico a ninguém...
-1,"Interface muito boa, atualizada. Porém o App está muitooooo instável. Não dá pra abrir, fica tentando mais nunca abre. Vamos melhorar que tá feio, ou melhor, horrível."
-1,Odiei.... pq uma vez abaixado... agora não entra mais em nada... coloco senhas e CPF e nunca entra... diz código inválido! Tô odiando já! Cancelando... não recomendo pra ninguém ok?.. Melhorem isso seus incompetentes
-1,"horrível, muito melhor a versão anterior, sai toda vez que termina uma transação e tem que colocar a senha tudo de novo!!!"
-1,"Essa última atualização tá horrível. Prefiro a versão anterior. Já tinha pago a fatura do cartão de crédito, mesmo assim descontou mais 180,00 da conta corrente, não entendi foi nada. Havia agendado uma transferência de 75,00 e não foi feito."
-1,ese aplicativo nao abre to passando raiva Ja tem3 dias.
-1,"É um app que por representar uma instituição tão grande deveria ser mais profissional, existem muitos erros, estou a 3 horas tentando logar e ele excedendo o tempo, melhorem!"
-1,Não funciona está bosta. .....cuidado ainda bloqueia o seu cartão de crédito. .....um lixo digital. ....uma excrecência de aplicativos. .....tá tudo certo na sua conta. .....Você vai na agência. .....e mesmo assim não funciona
-1,"Tô tentando acessar minha conta e não consigo , tá horrivel"
-1,"Ficou HORRÍVEL de entender as movimentações. Quem fez isso?! Pelo amor de Deus. Era tão simples antes. Por favor, tenham mais respeito com o correntista que paga taxas absurdas. Péssimo serviço."
-1,"Não tem acesso a conta salario, horrível"
-1,Totalmente favorável a um ladrao. Esse app teveria ter mais segurança
-1,"Nossa q bosta de aplicativo, estava adorando até o momento agora não funciona mais :("
-1,Muito ruim vão tomar no cú de vcs .
-1,"não gostei dessa niva versão, quero voltar para o antigo. estou tendo dificuldade"
-1,"Péssimo aplicativo. Obrigao o cliente a receber Notificações, mesmo você cancelando o serviço. Falta de Respeito."
-1,Não sei q bosta fizeram na atualização q nao entra mais
-1,"Era ótimo,fácil e prático.Depois da atualização ficou horrível,muita gente reclamando também ."
-1,lixo meu nome tá limpo e não aceita eu abrir a conta facio tô decepcionado com esse banco
-1,Nem abre mais essa porra.
