categoria,review
-1,Eu gostava mais como era antes na interface antiga. Não vi muita melhora e agora não está funcionando
-1,"O saldo apresentado na tela inicial não é o saldo disponível, app não está considerando o valor aprovisionado nem aplicação com resgate automático/ O acesso com a digital para conta empresarial está indisponível/ O acesso ao gerenciador financeiro a partir de um computador através da ferramenta BB code do app não está funcionando."
-1,"Depois de atualizar o app fecha sozinho, precisando urgente fazer movimentações e nada cadê o pessoal da TI ???? 🤔"
-1,"Essa nova versao ficou pessima.
A tela so funciona na vertical.
Era facilimo navegar, agora nao mais.
Por que a mudanca?
HORRIVEL.
Onde estao os pagamentos agendados?
A fatura do cartao ficou medonha.tudo junto,debito ,credito, parcelamento, a vista.
Como vcs conseguiram estragar um APP que funcionava tao bem?

Apos a atualizacao em Maio,ficou ainda pior.
Bloqueou minha senha ,em uma opcao que nem precisava de senha.
Bloqueou transacoes pelo celular,pedindo a liberacao do dispositivo,mesmo sendo o mesmo numero.
Cada dia PIOR."
-1,Não é possível realizar TEDs através do app. A cada tentativa recebo um erro genético pedindo que eu tentei mais tarde. Nem sequer uma mensagem amigável colocaram nos casos de erro. Me faz pensar em migrar pra outro branco com melhor suporte a tecnologia.
-1,Com essa atualização piorou tudo
-1,App fecha sozinho em segundos.
-1,Após atualização apareceu um app “fantasma” no meu iPhone 6s 👻
-1,"O aplicativo é instável, não conclui as operações. Os agendamentos somem do nada. Olha até entendo que a empresa queira atualizar para um aplicativo novo, com um novo design. Mas infelizmente sou obrigado a falar que o antigo era muito melhor, muito mais funcional. Se for pra atualizar pra não ter funcionalidade nenhuma, então que voltem para o antigo."
-1,"Banco medieval. Em pleno 2018 eu preciso ir até um caixa eletrônico do BB (nem 24h serve) para autorizar dispositivos móveis a fazerem transações, pagar boletos, etc. Nem consigo mudar o número do cel para poder operar!!"
-1,"Péssimo após a atualização o app não faz mais nada dentro dele sempre informa que a seção expirou e fazer login novamente , se vc vê o saldo conta corrente e tentar abrir o saldo poupança vc não consegue"
-1,Não está calculando o desconto no caso de pagar boleto antecipado. No app da Caixa funciona e no do BB não.
-1,"Sempre que vou entrar no aplicativo ele sai sozinho, as vezes coloco o touch e em seguida sai do aplicativo"
-1,Não consigo resgatar da poupança e nem fazer TED.
-1,O app diz que não está logado mesmo estando... última versão
-1,"Após a atualização de hj, ñ consigo fazer nenhum pagamento😕 ñ chega nem na parte de digitar a senha."
-1,Depois q atualizou não está prestando. Quando vai entra no app ele fecha sozinho
-1,"Após a atualização não é possível fazer transferência, fala que não está logado."
-1,"Depois da atualização ficou péssimo, por favor voltem à versão antiga!"
-1,"Depois da nova atualização não está funcionando, vc clica no App ele cai antes de digitar a senha."
-1,A primeira vez que entra no app tudo ok depois não entra mais! Vc digita sua senha e diz que seu aparelho está bloqueado! Vc vai à agência e nada consta  o sistema! Péssimo app!!!!
-1,O app não abre...! Ficou uma porcaria
-1,Não funciona o leitor do Código de Barras desse aplicativo.
-1,"Não consigo abrir minha conta jurídica. Pede senha da conta física, mas n passa disso"
-1,"Há quatro dias o app não está funcionando corretamente no meu iPhone Se. Pensei que iriam corrigir o erro rapidamente, mas não ocorreu. Não é possível fazer qualquer transação, pois o app some da tela segundos depois de aberto."
-1,"O aplicativo continua não aceitando números internacionais de telefone no cadastro.
O BB ignora a necessidade de milhares de brasileiros expatriados que continuam correntistas no Brasil."
-1,App depois dessa atualização de maio não abre. Simplesmente não abre. Ele abre e já fecha dando bug.
-1,Abro o App e ele fica fechando sozinho
-1,"Bom, gostaria de uma resposta, pois o App nem inicia no meu iPhone 5, oq fazer???"
-1,"Eu tento fazer um pagamento hoje e não permite pois precisa colocar a data de amanhã, sendo que ainda não são nem meio dia e nem é fim de semana ou feriado! Cheio de problemas"
-1,Nao consigo acessar pelo meu iPhone XS
-1,Depois dessa ultima atualização não consigo entrar iPhone 6s 🤬
-1,"Essa atualização limita a quantidade de pagamento de boletos online e muitas vezes, não lê códigos de barra e qdo vai digitar o código que é longo, nunca da certo, um horror! As invés de facilitar o uso complicou e não funciona direito! Péssimo 👎"
-1,Não consigo imprimir ou salvar o extrato
-1,"Conta encerrada, pois não sou obrigada a ter conta em um banco que paga jantar de “presidente” lixo que tá afundando o Brasil na miséria e acabando com a educação e o atendimento de vocês procurem melhorar pois das vezes que fui atendida em algumas agências nem documento pediam e me passavam todas informações pessoais... PÉSSIMOS."
-1,"Qualquer problema demoram muito pra corrigir,
Não esta funcionando para acessar com a digital ha dias e mesmo atualizando continua sem funcionar e não é a primeira vez"
-1,"Boa noite, após atualização não dá para ver o que está sendo cobrado nos lançamentos futuros, só mostra o valor total.
Tinha que ter um visualização melhor detalhada dos lançamentos.

Obrigado!"
-1,"Estou tentando acessar minha conta empresarial pelo acesso, fiz senha e já está habilitado para acessar, porém não consigo selecionar minha conta ."
-1,O pior aplicativo já feito por um banco
-1,"O app é bom, eu gostei muito moderno, só to achando ruim pra validar minha conta, pelo fato do meu RG ser antigo precisão corrigir!"
-1,"Quando vou acessar , da como celular bloqueado e eu fui 2 vezes no banco , para tentar resolver e no computador entra automaticamente sem restrição nenhuma !"
-1,"Após última atualização, o App simplesmente não abre, por favor notifiquem o que aconteceu. O App é muito útil, por isso peço resolvam o quanto antes o problema! Em caso de dúvidas, meu celular é um iPhone 5c."
-1,Por alguma razão não consigo fazer o update para o meu IPhone 7 Plus. A mensagem é que o item não está mais disponível.
-1,NÃO FUNCIONA MAIS ESSE APP. DE A OPÇÃO DE VOLTAR A USAR A VERSÃO ANTIGA OU VAI PERDER MAIS UM CLIENTE.
-1,"No início quando baixei ele era bom, agora está péssimo! Nunca consigo entrar! Só fica carregando e não entra! Horrível!"
-1,"O aplicativo é horrível! Atribui limites acabam acarretando atraso de contas importantes incorrendo em juros. Se é pra ser um aplicativo inútil desse jeito, não faz, melhor falar ao cliente para utilizar a agência física do banco, não esse aplicativo péssimo, como se fosse possível fazer as mesmas coisas que no banco físico. Péssimo! Obrigada BB pelo atraso na minha conta."
-1,"Imagine, além de ficar ruim, difícil de operar, complicado e cheio de problemas, piora a cada versão, tornando-se um pé no saco. Só o programador dessa mer** entende a lógica de operação. Fico pensando como um banco deste porte consegue produzir um software lixo como esse. PQP!"
-1,Desde quando baixei só utilizei uma vez e a conta é pago cancelando e desinstalando é furada galera não caiam nessa que um banco de verdade banco Inter.
-1,"Não sei que fizeram, mas pra mim, ao tentar atualizar na loja brasileira.. aparece a mensagem de ITEM INDISPONÍVEL.. PARABÉNS DESENVOLVEDORES! 💩"
-1,"Cliquei errado em um botão, e pronto! Não da voltar mais"
-1,"Apertura de conta pelo aplicativo é uma porcaria... se contradiz o tempo tudo. O suporte técnico e uma piada, modelo de ineficiência corporativa e burocracia. Levo MESES reportando um bug no processo de upgrade de conta e nunca teve solução. Estou vazando desse banco tão ineficiente bye bye"
-1,"O App funcionou mto bem até 3 dias atrás. Apareceu, então, uma mensagem de erro após a senha e simplesmente não consigo acessar minha conta. Já atualizei o App, instalei novamente e nada."
-1,Apagou a foto e não está dando pra cadastrar novamente.
-1,O mais complicado aplicativo de banco que existe
-1,A cada dois meses tenho que comparecer ao caixa eletrônico para reautorizar o celular a utilizar o APlicativo. Mesmo que eu não tenha mudado o celular. Faz perder a comodidade.
-1,"Já tentei fazer o upgrade na conta fácil duas vezes e agora não posso movimentar meu dinheiro, meu rg está dentro da validade e disseram que não condiz comigo, provavelmente minha carteira de motorista não seja aprovada porque está vencida, alguém por favor me ajuda !!"
-1,Tem como voltar para versão anterior? Eu vou fechar minha conta em razão disso.
-1,"Não funciona bem , apresenta constantemente erros de acesso ."
-1,Após a atualização o aplicativo não abre mais no Iphone 5! Péssimo!
-1,"Voltem pra Versão  anterior, essa nova dificultou mto"
-1,Sempre da erro na hora de entrar. É muito frequente. Precisando corrigir
-1,"Olá. Alguem poderia me ajudar? O app do bb ñ abre mais no meu tablet (sistema ios). 
Ja desinstalei e instalei novamente, mas ñ deu certo. 
O que devo fazer para conseguir acessá-lo?
Grata.
Ana"
-1,"A tela inicial é uma bagunça. Queria limpá-la e organizá-la, mas as opções de personalização são bem menores do que na app anterior. Cartões não são personalizáveis."
-1,"O app oferece inúmeras possibilidades, porém elas precisam ser confirmadas em um caixa eletrônico. Ou seja: possibilidades inúteis. Plenamente insatisfeita."
-1,"Muito pior que o anterior. Nao consigo fazer pagamentos com leitor de Barras, deposito em cheque por imagem o sistema derruba toda hora , extrato vem desde o dia 01 , impossivel mudar para outro dia .Nao tem como voltar a Versao anterior"
-1,"O APP piorou muito após a última atualização, você faz um TED, ele não acusa no extrato, perde totalmente o controle das suas transações!!!
Volta ao modo que era antes por favor"
-1,"Depois que atualizei o app ficou horrível de usar, muito lento, as opções não estão bem detalhadas"
-1,"Há 3 meses que não consigo atualizar esta porcaria, nenhuma nova versão carrega, o meu SE parou no tempo. 
Essa atualização virou defeito e nem instala nem sai da lista. Uma vergonha esse Banco de Brazuca.
Erro: this item is no longer available!"
-1,"Voltem para a versão anterior. Essa nova versão está uma porcaria. Tudo feito para dificultar. Pagamentos de cartão antes vc colocava o valor que queria pagar, agora precisa deduzir, colocar valor total etc. Vocês tentam inovar e só dificultam mais! Não posso voltar pra versão anterior???"
-1,"Apôs última atualização 7.3.0 o app não abre mais no meu telefone 😭
Fix it pleeeease"
-1,Instalei o aplicativo e ele não abre. Já desinstalei e instalei diversas vezes e não funciona. Simplesmente desaparece quando tento abrir. Preciso de uma solução urgente!
-1,"Já procurei a agência e fiquei 40 minutos, a atendente foi super atenciosa e se dedicou para ajudar, mas não conseguiu, o app não abre de forma alguma"
-1,Banco de dados indisponível e não sai disso 😔
-1,"Por favor, essa atualização trouxe alguns problemas, dentre os quais destaco este:

- Quando a pessoa seleciona a senha para atendimento, quer seja para caixa ou negocial, não pode fechar o aplicativo, por perde a senha. E o pior, não pode ser gerada outra. 

Infelizmente já perdi várias senhas de atendimento por conta disso. Se acaso a pessoa precise de alguma senha, não pode fechar o aplicativo. 

Era pra o sistema armazenar a senha ou poder gerar outra."
-1,"O app oferece inúmeras possibilidades, porém elas precisam ser confirmadas em um caixa eletrônico. Ou seja: possibilidades inúteis."
-1,N consigo fazer up grade da minha conta pois na hora de clicar em self o app apresenta um erro
-1,Não consigo mais acessar depois que atualizei a versão. Aparece uma imagem “Ops” e não conclui
-1,"Essa nova versa não mostra detalhadamente o que vc gastou na fatura do cartão, ele só mostra o valor total. Como vou verificar o que foi comprado? Prefiro a versão anterior."
-1,"Com a atualização do app o leitor de código de barras não funciona no iPad.
Antes da atualização funciona bem, às vezes quando digito o código ele também não aceita.
Para que mexer no que funcionava bem sem perguntar a quem usa."
-1,"Sobre o INSS
Não consigo visualizar as vias de empregador e contribuinte. 
Na versão anterior, após o pagamento, isso era possível.
Na versão atual, visualizo apenas um demonstrativo básico.
Quando eu preciso das duas vias, tenho que ir a um caixa eletrônico."
-1,"App não funciona reconhecimento Facial, versão antiga funcionava."
-1,Não estou conseguindo abrir o aplicativo no iPhone 4s .. Uso para trabalhar .. E agora... Arrumem isso.. Presizo fazer pagamentos
-1,"O aplicativo esta horrível. 
Vc quer fazer um transferência de conta para a poupança. O desenho é péssimo, confunde o correntista"
-1,"Desinstalei o app e agr q quero instalar dnv parece q ele ainda está baixado, como arrumo isso?"
-1,Estava acostumada com a versão mais antiga e sem querer atualizei. Gostaria de saber se tem como voltar a versão de um app?
-1,"Essa atualização impossibilita que a gente personalize o acesso rápido e dispõe de apenas 6 opções, o que é insuficiente para mim. A visualização rápida da fatura mostra o histórico em ordem cronológica, um retrocesso ao agrupamento por categorias na minha opinião, que facilitava muito a visualização. O Chat não envia notificação quando o gerente responde, o que dificulta a conversa, pq exige que fiquemos à disposição da conversa, ou o atendimento é finalizado antes de vizualizarmos a resposta. Muito a melhorar. Preferia o layout anterior."
-1,"Muito confusa, sem praticidade alguma. Gostaria de ter a versão anterior de volta!"
-1,O aplicativo anterior era muito mais amigável que este. Achei a mudança negativa e pouco produtiva... continua cumprindo as boas tarefas do anterior mas muito ruim.
-1,"Péssimo não acessa no iPhone 6s da um erro de telefone bloqueado, mais já foi liberado na agência"
-1,"Com esta nova versão não encontro minhas finanças, tinha na versão anterior, era ótimo para  eu ter uma projeção dos meus gastos. Outra situação é que não colocam todos os parcelamentos na próxima fatura, só alguns são mencionados o que pode nos levar a erro na visão dos gastos futuros, chego a ver malícia na intenção."
-1,"Horrível, o do Bradesco é muito mais prático!"
-1,"Após atualização o APP pessoa física ficou mais complexo nas transações, principalmente nas transferências, pois é necessário vários click de avançar para concluir a transação. A fonte das letras e números da agência, conta e valor, ficou pequeno demais, chega a confundir o cliente. Espero que os criadores desse APP vejam isso e busquem melhorar"
-1,"O antigo era 10 mil vezes melhor! Esse você não consegue mudar o nome das transações, o leiaut é péssimo. Horrível. Só baixei pq realmente preciso!"
-1,Não consigo o código de barras pelo aplicativo
-1,"Não estou conseguindo desbloquear meu cartão do Brasil, pelo app no iPhone 6s"
-1,Esse aplicativo cada vez que atualiza piora ou estraga outra função! Não da para entender!
-1,"Uma porcaria o sistema de senha online!

Emitimos a senha e não é chapado simplesmente pulou para próxima."
-1,"Achei que a janela de extrato ficou ruim porque existe uma máscara com saldo da conta, de dimensões exagerada, que não sai da frente nem pode ser minimizada. Assim a parte da janela que se utiliza pra ver os dados na conta ficou muito pequena. Para o usuário importante é ver os dados da conta e não saldo."
-1,"Substituíram um aplicativo extremamente funcional e prático por um inutilizável. Todo mundo reclamando que o novo aplicativo está bagunçado, confuso, pouco intuitivo e inconsistente. Ficou bizarro e chega a ser angustiante usar. Uma lástima."
-1,"Toda vez que abro, ele minimiza e volta pra tela principal do IPhone."
-1,Essa atualização veio para dificultar as coisas! Péssima
-1,O aplicativo não está abrindo.
-1,"Depois da última atualização, apagou do histórico as transferências anteriores. Ficou péssimo. Não consigo mais transferir para uma conta poupança."
-1,Pq não aparece o valore local das compras débito e crédito???
-1,"A nova versão veio pra dificultar, com péssimas visualizacoes. Não consigo resgatar nada da poupança e precisava fazer uma transferência da mesma pra minha conta corrente e não consigo."
-1,"Quando pede o número da minha agencia, não consigo inserir a letra X, ficando sempre errado"
-1,"Sério depois dessa última atualização de vcs que mudaram totalmente a interface do app, até pra fazer uma simples transferência é uma dor de cabeça, ficou tudo muito mais difícil é quase impossível usar o aplicativo do banco. Coisas que antes eu levava menos de 1 minuto pra fazer agora levo de 3 a 5 minutos ou então tenho que pedir ajuda porque não consigo nem achar a opção para o que preciso fazer..."
-1,"O app não abre no meu iPhone 5 (iOS 10.3.3), quando clico pra abrir aparece a logo do BB com o fundo amarelo e logo depois fecha sozinho 😞"
-1,App não abre depois da última atualização no meu iPhone 4s. Não abre de jeito nenhum
-1,Prefiro a versão antiga do App!
-1,Meu aplicativo não estar funcionando depois que atualizei
-1,"O aplicativo anterior era bem melhor.
O que melhorou:
- o design está mais bonito.

O que piorou:
- está mais confuso achar as coisas
- agora os recibos de pagamentos não são visualizados automaticamente. É preciso mais um clique para visualizar e depois imprimir
- os lançamentos futuros sumiram. Não há como colocá-los na tela inicial. É preciso navegar. Agora mesmo eu fiz um agendamento de pagamento, e demorei até achar para confirmar
- antes aí entrar no app já visualizava o saldo, um resumo dos últimos movimentos, e quanto havia em resgate automático. Agora é preciso navegar para achar essas informações.
- as mensagens de uso do cartão não são mais enviadas por SMS. Agora são mensagens dentro do app. Para apagar deve-se visualizar e depois deletar. Resultado: já tenho 50 mensagens e o número não para de crescer

Em resumo, está mais bonito. Mas beleza não é a prioridade, eu quero é facilidade de uso. Quem desenvolveu provavelmente não utilizou pesquisas de opinião para saber o que os usuários queriam no app.

BB, se puder, eu quero voltar para o app anterior"
-1,Aplicativo não abre desde a última atualização e nesta continua sem funcionar.
-1,"Trava, cheio de bugs!!! Não consigo acessar o app!!! Ficou um lixo!"
-1,"Impossível abrir Conta Fácil MEI nesse app. Não consegui em 3 celulares diferentes! Vou abrir conta em outro banco já que tentei pelo SAC, ouvidoria e agência física!"
-1,Essa nova versão está bem ruim !
-1,Após a atualização não aceitou minha senha do aplicativo e bloqueou meu acesso.
-1,Mal aproveitamento da tela. Na página do extrato da conta sobrou só metade da tela para ver as informações.
-1,App fecha sozinho depois das últimas atualizações (iPhone 4s)
-1,"Realmente banco do brasil mesmo, rouba mais q tudo"
-1,"Essa atualização deixou o app complicado. Criei e desbloqueei minha senha no caixa eletrônico, mas ao coloca-la no app, diz estar errada e bloqueia novamente. Detestei. O app era prático e fácil, não havia necessidade de complicar dessa maneira"
-1,"A atualização ficou péssima. O controle da fatura do cartão ficou muito ruim, péssimo!!!"
-1,"Não consigo abrir, não carrega a tela e automaticamente fecha"
-1,Depois da atualização está travando!
-1,"Nao consigo baixar mais! 
Ajeitem ou disponibilizem o apo"
-1,"Substituíram um aplicativo extremamente funcional e prático por um inutilizável. Todo mundo reclamando que o novo aplicativo está bagunçado, confuso, pouco intuitivo e inconsistente. Lamentável."
-1,"Depois da atualização entra a tela amarela,  com o simbolo do banco e , simplismente fecha o programa."
-1,"Olá. Lamentavelmente, faz mais de dois meses que o app não abre mais no ipad (sistema ios) Espero solução dos programadores, pois dependo dele para trabalhar. 
Grata."
-1,"O aplicativo ficou muito confuso depois da atualização!
Hoje mesmo fui consultar um empréstimo e ele acabou fazendo um empréstimo sem ao menos pedir senha!

Ficou péssimo essa atualização!
Agora eu vou ter que arcar com o prejuízo! 🤨"
-1,"Desde que atualizou não consigo acessar o gerente virtual, apesar de continuar como atendimento virtual."
-1,"Ficou pior, muito confuso, a versão anterior era muito melhor!"
-1,Os boletos não compensam nunca.
-1,"Após a atualização o app sequer abre. Já liguei para 0800, passei email para o suporte, fui a agência e nada.
Estou tendo que ir as agências efetuar transações. No note pede o QR code enviado para o app que não funciona.
Até quando?"
-1,A nova versão trava constantemente. É lenta para abrir as opções. Pouco intuitiva. Não se acha nada!
-1,Depois dessa atualização o app não abre no iPhone 4s
-1,"Depois dessa atualização, virou uma confusão às informações da C/C."
-1,"Todo mundo reclamando da versão do aplicativo e nada é feito pra mudar. Sou funcionário e atendo meus clientes por telefone e chat e tenho muita dificuldade em ensiná-lo. Custa colocar os nomes nos Menus?????? É melhor que ficar dizendo “clique na casinha”, no “bonequinho” etc.  Modernidade e facilidade podem andar juntos."
-1,"Conseguiram estragar o app, essa nova versão, com cara “nova” é horrível... quando vão parar de mexer e estragar o que funciona tão bem????"
-1,O aplicativo não funciona mais no iphone 4S. Corrijam isso por favor.
-1,"Após a última atualização, o app não permite logar usando a rede wireless apenas com a rede móvel do aparelho (3G)."
-1,Boa tarde está dando um erro s503 desde ontem por favor arrumem
-1,instalei desinstalei e nada horrível
-1,"Olá, toda vez que peço pra atualizar ele da um erro e não faz a atualização!"
-1,"Odiei a nova atualização 
A antiga podia arrumar tudo do meu gosto e esta está muito poluída com informações que não quero ver ao invés do que é importante"
-1,"Depois dessa nova versão ficou lento, é difícil achar as funções, prefiro a versão anterior"
-1,"Sempre utilizei meu IPAD para fazer minhas transações financeiras. Mas depois da atualização com essa nova versão, não consigo acessar o site de BB, pois o aplicativo não abre."
-1,"Não está fazendo transferência a qualquer hora nem feriados e final de semana obs: no Bradesco faço transf a qualquer dia e qq hora 
FUCA A DICA"
-1,"Estragaram o App!! Lento, pesado e confuso... Na página de extrato aparecem informações irrelevantes e não sobra ""tela"" para os lançamentos..."
-1,A versao atualizada não me permite entrar mais em minha conta para acessar nenhum dado.
-1,"O NÚMERO DA MINHA CONTA VEIO ACOMPANHADO COM “X” NO FINAL. CARA, COMO ASSIM?????"
-1,Não estou recebendo nenhuma notificação desde 16 de abril .
-1,"Muito ruim, não dá pra fazer o upgrade da conta, da erro ao tirar selfie, arrumem isso."
-1,"Se eu quisesse “Agendar” um pagamento eu teria escolhido a opção “Agendar” e não “PAGAR”, porcaria de irracional!! Perdi tempo pensando que havia pago um boleto mas na verdade tava “Agendado” pra data do vencimento! Se eu escolho a opção PAGAR e pra PAGAR IMEDIATAMENTE!!! Porcaria!"
-1,"Estou achando muito ruim esse aplicativo, eu só tenho o cartão de crédito, não consigo ver com clareza o limite e tão pouco o melhor dia de compra, estou achando muito ruim.
Obrigado"
-1,Não funciona mais a operação para pagamento e quando consigo acessar o app ele são totalmente. Não funciona a atualização.
-1,"Ao tentar abrir a conta facil o app da uma mensagem de DDD do celular nao localizado, mas o app nao permite avancar sem estes numeros.
Fico impossibilitado de prosseguir, ou corrigir os dados, fui na agencia e liguei na central, mas nao sabem o que ocorreu.

 E ai?!"
-1,"Ao tentar enviar TED apresenta mensagem de erro DOC D não permitido (G787-617) codigo S503. Antes que me perguntem, eu escolhi TED mesmo. E o sistema antes de pedir a senha apresenta essa mensagem."
-1,"Detestei essa nova versão, basta a tela bloquear ou você alternar de aplicativo que ele des-loga e sou obrigado a entrar com chave e senha novamente , também detestei o menu iniciar que não tem mais meus atalhos de operações frequentes, nem mesmo as de transferência, falando em transferência nunca vi tanto rodeio pra fazer uma , são inúmeros cliques e diversos avançar, as letras estão miúdas mal da pra confirmar valores e dados da conta creditada, não sei por que atualizar um aplicativo que era bom pra um mil vezes pior, outra coisa, se eu tenho três contas de uma mesma pessoa de bancos diferentes não tem mais como saber pra escolher o banco pois aparece só o nome do favorecido e nenhum outro dado pra que eu possa escolher a conta certa !! Afffff..."
-1,"Horrível, cobraram taxas de 10 reais e não me avisaram nada, só fiz a conta pra guardar dinheiro e ainda tem que ficar pagando pra vcs guardarem? NÃO FAÇAM CONTA, tem muitas taxas e nada de vantagem."
-1,Zero e mx.
-1,"Depois dessa atualização não posso mais fazer simulação de empréstimos consignado, não posso mais vê quantas parcelas falta. Ficou horrível."
-1,"Nova atualização horrível, o que eu mais gostava no Banco do Brasil era o aplicativo, essa nova plataforma está muito confuso e nos deixa perdidos."
