categoria,review
-1,"Eu, como procurador, não posso assinar esta merda. Você só tem me ferrado, Paola, que raio de gerente que você pensa que é?"
-1,Existe alguma atitude a ser feita após essa ligação? Estou muito preocupada e chateada
-1,Existe alguma forma de passar a minha conta para estilo? Estou bastante chateado com esses problemas com o BB.
-1,Extremamente decepcionada.
-1,FIQUEI MUITO CHATEADO POIS NUNCA TINHA ACONTECIDO ISSO
-1,Favor deixar com algum gerente que saiba sobre o que é o contrato. Fiquei muito chateado com o descaso e desinformação anterior .
-1,Fico chateada  com essas informações truncadas e se só comecei a usar o cartão pela isenção da anuidade
-1,Fico chateada pq nunca autorizei que fizessem esse débito
-1,Fico chateado do banco do Brasil não financiar a moto que eu quero
-1,Fico chateado por isso tenho moral com outros bancos Onde nem conta eu tenho porém no próprio banco que movimento não consigo nada
-1,"Fico extremamente chateado, pois toda vez que preciso renovar o abatimento, há uma falta de conhecimento absurdo por parte do banco"
-1,"Fico muito chateado em fazer isso, mas o banco está cobrando o dobro para funcionário sem sinistro"
-1,Fiquei ausente de internet e celular por 10 dias só voltei com assesso ontem quando pude verificar no qual me deixei surpreso e chateado
-1,"Fiquei bem chateada, uma vez que zerei o que tinha, só  fiquei com uma mensalidade da apolindia que vai mais uns meses."
-1,Fiquei chateada
-1,Fiquei chateada agora..
-1,Fiquei chateada e acho que fui prejudicada...
-1,Fiquei chateada pois já faço o debito automático pra não acontecer isso.
-1,"Fiquei chateada pois não fui comunicada, e poderia ter te comunicado com antecedência. "
-1,Fiquei chateada por nem terem ligado par mim.
-1,Fiquei chateada por vcs não ligarem antes de resgatar na minha conta corrente
-1,Fiquei chateado
-1,"Fiquei chateado com o cartão ourocard, diz umas compras no fim de semana achando que o cartão sempre vira no dia 22 e as vezes até antes."
-1,"Fiquei chateado pelo processo bancário em si, e agora eu ter que tentar resolver esse problema com uma instituição q eu acabei de descartar"
-1,Fiquei chateado tanto com ela qto com vcs por não poderem segurar um dia!!!
-1,Fiquei em apuros hoje  e decepcionada. Muito decepcionada!
-1,Fiquei extremamente chateada
-1,"Fiquei frustrado com o banco do brasil, eu esperava receber um cartão Master Black ou Platinum, e recebo um cartão Elo"
-1,Fiquei insatisfeita com o atendimento
-1,Fiquei insatisfeita com seu atendimento.
-1,Fiquei muito chateada com a situação. Achei um descaso do banco e da Brasilprev
-1,"Fiquei muito chateado e liguei para o Itaú Personalité, que eu tb sou cliente. Recebi uma proposta igual a do BB 50?"
-1,"Fiquei muito chateado pois já tinha tomado todas as medidas cabíeveis e aí assim estava sendo exigida a minha ida à agência para fazer uma contestação de um valor de R$ 10,00 o que é um absurdo."
-1,Fiquei muito insatisfeito com o ocorrido!
-1,Fiquei super decepcionada
-1,"Fiquei super insatisfeita com essa mudança! E agora mais preocupada com o fato de você não estar nem sabendo. Por favor, preciso de retorno"
-1,Fiquei um pouco chateado por nada me ter sido antecipado.
-1,Fiz uma correria para mandar o motoboy a tempo... o aconteceu? Tô muito chateada!
-1,Foi que fiquei sabendo pela central agora. .. grande merda ser  cliente estilo!
-1,Fui falar c um funcionário que não me respondeu a contento e pelo telefone já cansei de esperar
-1,Fui pagar uma merda de fatura e não consegui
-1,"Gabriela, estou decepcionado com essa demora, que vai nos prejudicar e muito o nosso planejamento"
-1,Gostaria de saber quem autorizou isso Estou muito chateado pois eu não autorizei isso
-1,"Quero transformar minha conta em conta salário. Quais são os trâmites? 
Cansei do péssimo atendimento em agencia"
-1,Hoje Rosana perguntou o endereço de entrega e a bandeira. Falei da urgência q tinha. Estou muito insatisfeita desde que mudei p Estilo.
-1,Honestamente cada dia mais decepcionado com as coisas do banco do Brasil
-1,Imagina o quanto estou bravo
-1,"Infelizmente desativada. , figo infelizmente  por estar muito decepcionada com a agência e atendimento para a qual me enviaram  na Epitácio"
-1,Infelizmente estou muito decepcionado com a imprecisão das informações prestadas
-1,Infelizmente meu marido está bem irritado com o atendimento.  Vão perder um clinte
-1,"Infelizmente o atendimento do BB é pessimo em boa parte das agencias. Ja fiquei 2h esperando pra comprar dolar, me recuso a passar por isso."
-1,Infelizmente vem acontecendo situações  que me deuxam chateada  nessa agência.
-1,Insatisfeita! Muito péssimo atendimento! Quantas pessoas pra cada gerente no chat???
-1,Insatisfeita. Já não é  na primeira vez.
-1,Irritado
-1,Isso não é certo!!! Fiquei muito chateada.
-1,Isso é  sacanagem
-1,Isso é que me deixa chateado. Só vou saber do problema quando preciso e normalmente é em horário desconfortável.
-1,Isso é um pessimo servico
-1,"Isso é uma sacanagem, pois se fosse o contrário. Estaria pagando multa, juros ..."
-1,"Isto me deixa chateada, eu nunca consegui fazer transferencia, por causa do celular que nunca consegui cadastrar."
-1,"Izabela, porque que me mandaram para essa agência potiguar fazer esse financiamento? Odeio aquela agência com todas as minhas forças"
-1,Ja estou bem chateada com o fato de ter sido expulsa da minha agência. Espero não ter mais surpresas daqui pra frente.
-1,Ja falei que nao quero proposta! Que merda sô!
-1,"Ja liguei na central e eles nao se importam, cancelaram meu cartao e é isso, falta de respeito, pessimo atendimento"
-1,"Jaqueline, esperei vc me ligar hoje. Contudo, vc não fez contato. Estou decepcionado."
-1,"Juliana, bom dia, tiraram o limite, me desculpe a palavra, é uma pulta sacanagem, para mim fica claro que o banco esconde informações de vocês ou faz isso com os clientes. Aguardo contato, vou procurar o Procon."
-1,Já estou chateada com vocês. Até hoje não responderam os meus questionamentos dobre o seguro de meu carro.
-1,"Já estou ficando chateada com isso, tenho o dinheiro na conta e não me permite pagar meus compromissos."
-1,Já fiquei extremamemte chateada de não obter com vocês a informação do local onde foram realizados saques indevidos da minha conta corrente.
-1,"Já fiz tudo isso, mas não foi alterado. O atendimento foi pessimo, demorou e a atendente não sabia alterar."
-1,Já perturbei bastante. Fiquei muito nervosa
-1,"Lamentavel seu atendimento !!!!! Eu preciso de (SOLUÇOES) e nao DIFICULDADES, estou registrando uma reclamação na OUVIDORIA e NO BACEN, a respeito do seu PESSIMO atendimento. Quem criou o problema foi vc e o BANCO. Seu atendimento NAO ESTA DE ACORDO com.."
-1,"Lau, estou bastante decepcionada com o atendimento recebido. Cinco dias atrás,  tentei contato com  você  sem sucesso. "
-1,"Lembra que o ano passado,estávamos em Dubai e passei vexame também. Sinceramente estou muito chateada."
-1,"Leomar, o que mais me deixa insatisfeito é a questão de simplesmente realizarem as mudanças sem comunicação previa"
-1,"Lucas, eu preciso desse cartão liberado meu amigo. Estou muito insatisfeito com o atendimento de vocês desde que mudou para BB estilo."
-1,"Luciana, mas estou extremamente insatisfeito com a forma como as coisas vem ocorrendo."
-1,"ME DESCULPE EU SEI QUE VC. NÃO TEM NADA HAVER COM A HISTÓRIA, ESTOU CHATEADO COM SUA FUNCIONÁRIA QUE PASSA ALGO NÃO SEI SE ELA NÃO SABE, OU SE USOU SÓ PRA ABRIR O CARTÃO"
-1,MUITO INSATISFEITA COM O TRATAMENTO RECEBIDO.
-1,MUITO INSATISFEITO.
-1,Mais uma vez fico insatisfeita com o banco do brasil!
-1,"Marta, estou decepcionado com o banco, sou cliente há anos e nunca deixei de pagar uma conta, estou mobiliando meu apartamento"
-1,"Mas acho que já fechou a fatura. Pode ser! Fiquei tão chateada com essa situação, por despreocupação minha."
-1,Mas alteração na Conta Corrente estou extremamente insatisfeito.
-1,Mas assim do jeito que foi feito tirando dinheiro sem minha autorização é sacanagem
-1,"Mas este mês me fez ficar muita chateada, afinal sou cliente do banco a mais de 20 anos"
-1,Mas estou chateada com essa situação
-1,"Mas estou tão chateada com isso, optei por pagar o cartão BB integral, pra ter meu cartão livre pra qq emergência com a bebê nascendo"
-1,Mas fico muito chateada o BB nunca  perdeu dinheiro comigo ao contrário  ganha muito dinheiro nos diversos empréstimos que tenho
-1,Mas qto a mudar a conta e agência fiquei chateada
-1,"Mas, apesar de ser ridicularmente pouco este valor, ainda vão diminuir mais? Lhe pergunto, o banco está forçando certos cliente a fechar a conta, é isso? Estou cada dia que passa mais decepcionado com o banco, antes eu tinha vários limites de crédito"
-1,"Me cansei, Guilherme. Perdi a confiança em você como profissional e no BB como instituição"
-1,"Me deixou muito chateada, pois já tinha visto que para volumes pequenos é melhor usar algumas corretoras e agora mais essa cobrança"
-1,"Me desculpe mas fiquei muito chateada, parece que não se tem nenhum respeito pelo correntista"
-1,"Me desculpe, mas estou bastante chateado"
-1,Me direcionaram para o caixa... sai decepcionado. Já não tenho tempo de ir a banco no dia que vou me fazem uma dessas
-1,Melhor ser tratada como estilo sem ser do q ser estilo e viver estressada com o banco.
-1,Merda
-1,Merda de cartão elo
-1,Mesma coisa do geral praticamente. To decepcionado
-1,Mesmo sendo devido eu continuo chateada pois não me avisaram de um erro de tanto tempo e me fazem utilizar o limite que eu não necessitava
-1,"Meu limite real é de 2400,00 reais. É só isso que é permitido... Infelizmente. Decepcionada com o serviço."
-1,"Milena: Minha sogra esta na UTI em Curitiba, eu estou de carona, e SEM DINHEIRO, estou muito nervoso, SE ELA MORRER, como eu faço....me ligue....não vou ter acesso ao PC ..."
-1,Minha conta tem origem no posto da jf.  Posso retornar para aquele Posto?  Estou insatisfeita com o atendimento da agência estilo
-1,Minha esposa está tremendamente chateada pois é coordenadora de atendimento de um laboratório médico e disse que nunca viu tamanha falta de
-1,"Minha renda é  de mais de trinta mil por mês,  se o banco não tem condições de atender com um mínimo de atenção vão  para merda!"
-1,Muita sacanagem
-1,Muita sacanagem vespera do dia das maes me deixar na mao
-1,Muita sacanagem. Nunca aconteceu isso.
-1,Muito chateada
-1,"Muito chateada!!
Transtorno poderia ter sido evitado"
-1,Muito chateada. ..
-1,Muito chateado com os transtornos que o Banco esta me causando
-1,Muito chateado com tudo isso
-1,Muito decepcionada com o Banco
-1,Muito decepcionada com tudo isso!!!
-1,Muito decepcionada!
-1,Muito insatisfeita
-1,Muito insatisfeita com este método de atendimento
-1,Muito insatisfeita!!!
-1,"Muito insatisfeita, muito chatiada"
-1,Muito muito chateada!!!
-1,"Muito ruim isso. Aliás, pessimo"
-1,"Na verdade estou bem insatisfeito em pagar 59,90 mensal pela taxa de pacote de serviços a ponto de consultar outras instituições"
-1,"Na verdade eu tenho conta no Banco do Brasil desde 1997, e nunca paguei tarifa é a primeira vez que estou sendo cobrado. Estou muito insatisfeito com o atual serviço do Banco."
-1,Nao consigo transferir um recurso devido a uma burocracia de merda de vcs.
-1,"Nivea, estou muito chateado com a desorganização do Banco do Brasil."
-1,No Serasa e sem limites no cartão de crédito devido à isso. Enfim muito chateada c tudo isso q o Banco do Brasil está me fazendo passar.
-1,"Nossa eles pedem o numero esta vendo como estou muito insatisfeita com o Banco, esta tudo errado"
-1,"Nossa preocupação é que o INSS retenha o benefício em razão de primeiro depósito frustrado. Não esperávamos essa dificuldade toda de abrir nova conta corrente, diante do relacionamento antigo com o banco."
-1,Nossa que sacanagem isso
-1,Nossa tô puta da vida
-1,"Notificando de nova transferência para a agência 3331-6. Não gostei e registro que estou insatisfeita, foi realizada a nova transferência sem consulta."
-1,"Nunca conseguia resolver nada por telefone, tendo q me deslocar para lá , o que era sempre um transtorno. Estou muito chateada!"
-1,NÃO FOI ISSO QUE COMBINAMOS ESTOU CHATEADA
-1,NÃO QUERO QUE MEXA NA OPERAÇÃO  ANTERIOR. Baixar juro e um direito do consumidor. Fiquei decepcionada.
-1,Não aceito que minha conta seja transferida para a agência central! Estou absolutamente chateada com essa carta que recebi!
-1,Não me avisaram de nada e estou super chateada com tudo isso
-1,Não precisa mandar mais nada. CANSEI
-1,"Não preciso, sinceramente, estar a essa hora submetida a um atendimento ruim, que não valoriza a urgência em resolver a minha questão. Como cliente, sinto-me absolutamente decepcionada com este serviço a mim oferecido pelo chat."
-1,"Não quero comprar no limite do crediário, fiquei muito stressada hiper chateada"
-1,Não recusa. Mas o que informa é que o BB não dá resposta. E eu já estou chateada. Não faz sentido.
-1,Não sei do q se trata. ..nossa tô passando mal de nervoso
-1,"Não sou vigarista, porra!"
-1,"Não só sou eu insatisfeita com vcs, o rh tem recebido reclamações"
-1,O atendimento  de Carlos foi pessimo
-1,"O da Seguradora passou medidas erradas para elevar o preço e ainda vão tirar de mim R$45, 00 mesmo sendo desonesto. Muito bravo com isso"
-1,O seu retorno? Estou muito decepcionado com a postura do BB.
-1,Odeio BB code
-1,Odeio a agência da praça XV
-1,Odeio essa história de virtual e não tenho saco de ligação virtual tb onde a pessoa me faz mil perguntas!
-1," Contatei com 08007290200,   Não me parecem conhecer este tipo de problema. Irritante. Deveriam ao menos ter uma relação de códigos para informar o significado, Se não para que  código? Estou pensando em desistir de pagar"
-1,"Que sacanagem, não fui avisada com antecedência. Acredito que todos os clientes com esse tipo de aplicação deveriam ser comunicados. Vc sabe me explicar a razão dessa mudança?"
-1,Oi Maria estou discando a horas e ninguém me atende nessa central. Estou bem insatisfeita com essas mudanças.
-1,"Oi Odilon, boa tarde! Estou mto chateada com o atendimento do BB"
-1,"Eu estou insatisfeito e indignado com o atendimento: primeiro, porque no atendimento eletrônico, como sempre, a opção desejada é sempre a última; tenho que ouvir um elenco de opções à espera do que realmente quero; segundo, o atendimento é rui"
-1,"Não vou fazer você perder tempo, mas sinceramente estou profundamente chateada e me sinto humilhada. "
-1,Espero que vc me ligue até às 09:30 hs... Estou decepcionada com o Banco do Brasil!!!
-1,"Só estou decepcionado com as atitudes tomadas pelo banco que, sem aviso prévio, suspendeu o crédito de um cliente com conta desde 1994."
-1,"Olha e porque estou muito insatisfeita, desde que mudei para aí tenho problemas"
-1,"Olha estao entao de sacanagem comigo, pois tentei 3 vzes e bloqueou a minha senha, pois estava dizendo que a senha não confere"
-1,"Olha fiquei decepcionado com a negativa de atendimento. Entendo que cheguei após o horário, mais somos colegas de trabalho."
-1,"Olá amiga. Estou chateado com o BB. Primeiro cheque que utilizo, e já me devolvem por motivo 22, divergência de assinatura?"
-1,Outra coisa que tô puto com vossa instituição. Que porra é essa de sempre o limite do cartão esta arrendodado. 
-1,"... procurei por duas vezes a agencia para resolver, sem êxito. Agora é com a justiça já que não me deram a minha importância"
-1,".......que fizeram!! Se continuar essa situação desgastante irei recorrer à justiça, pois, não sou peteca para ficar indo de um lado para"
-1,"De outra forma serei obrigado a consignar também esse valor judicialmente para evitar que seja tomado pelo banco, para uma divida que no meu entendimento já está totalmente paga."
-1,...recebo essa mensagem fora do contexto da conversa e com um dia de atraso.
-1,"A culpa do cliente, né? Peça pra gerente ligar então... vc não respondeu uma pergunta q lhe fiz!!!"
-1,A caixa deu retorno da reclamação que fiz ma ouvidoria
-1,A minha reclamação foi de que veio duas cobranças e recebi no celular era pagar o de 26/04/2017. Desta vez se houver problemas vou levar o caso ao Banco Central porque vocês na agência estão me criando sérios problemas.
-1,ANDERSON caso nao possa me isentar da anuidade devo encerrar minha conta e passar para outro banco.
-1,"Absurdo. Eu não sou de reclamar, pois como não uso banco, só necessito de um atendimento esporádico igual ao seu. Peguei recentemente os car"
-1,Parabéns pelo pessimo canal de atendimento
-1,"Pela demora na resposta, eu desisto."
-1,"Pense que fiquei chateada, e sem contar no constrangimento que se passa"
-1,Pessimo atendimento dessa gerência on-line.
-1,Pode estornar o meu salário seus ladroes! Quero a porra do meu dinheiro de volta. Eu não fiz acordo com vcs pra vcs botarem a mão no meu din
-1,Porra fdp
-1,"Pois é , estou precisando do dinheiro . Preciso quitar meu carro. Já estou chateada com essa situação"
-1,Até entrei na página do Facebook do BB para reclamar
-1,"Até lá e até o momento de encerrar isso tudo, pra nunca mais lidar com tanto amadorismo!"
-1,"Precisamos marcar uma conversa urgente e definitiva. em mais de 20 anos no BB nunca me incomodei. a propósito minha esposa também, está muito insatisfeita aí com o gerente Fernando: vai tres vezes e nada se resolve."
-1,"Primeiramente, venho registrar que estou insatisfeita com o BB,por ter feito alteração no atendimento da minha conta sem me consultar antes."
-1,"Puta merda! Desculpe, mas é um desabafo"
-1,Puta que pariu. Faz 15 dias que estou lhe falando sobre isto e você deixa para o último dia para pedir o comparecimento aí para assinar. Já lhe falei que hoje ela não pode. Não é uma folgada que pode deixar seu trabalho a qualquer momento.
-1,Quando ele não estiver posso pedir pra falar com vc então? Ando muito insatisfeita com o atendimento do BB em agência e por telefone.
-1,"Quando tenho ido, está sempre lotado e desisto"
-1,"Se eu for para outra instituição , vou usar esta margem que tenho no contracheque, e aos poucos vou saindo do BB. Vcs vão perder um cliente muito rentável p o banco. Estou insatisfeito e aguardo uma ação efetiva por parte da gerencia"
-1,É uma proposta quase imoral que subverte o objetivo da CMN. Consequentemente me deixa extremamente insatisfeito com a postura do Banco do Brasil.
-1,trabalho meu de muitos anos....poxa...estou chateada com a conduta do banco.
-1,"Mais de 40 minutos de fila, absurdo"
-1,Fechem as portas
-1,Que merda de serviço
-1,Que piada!
-1,Absurdo!
-1,Essa propaganda é muito chata
-1,O plugin de segurança não está funcionando.
-1,Odeio o assistente virtual de vocês.
-1,Banco péssimo!
-1,Não consigo pagar um boleto!
-1,É o pior banco que eu já fui.
-1,A TED é muito demorada
-1,Estão me cobrando um absurdo de anuidade do cartão
-1,Um horror de atendimento
-1,Não recomendo.
-1,Demora muito para ser atendido
-1,Funcionários relapsos e preguiçosos.
-1,Equipamentos não funciona
-1,Tudo péssimo
-1,Estou dias sem conseguir usar meu cartão de crédito
-1,O novo modelo de atendimento do Banco do Brasil não funciona
-1,Esse banco só me ferra
-1,Falta de respeito com o cliente!
-1,Contratem mais gente
-1,As soluções digitais não funcionam
-1,Só passei raiva até hoje com essa conta do BB
-1,Deveriam melhorar o serviço presencial
-1,É o pior banco do mundo
-1,As taxas cobradas são um absurdo
-1,Site cheio de bug
-1,Pior atendimento do mundo
-1,Pior Banco da face da terra
-1,Pior Sac do mundo
-1,Esse bot é irritante
-1,Estamos muito triste com o banco do Brasil
-1,O Facebook do Banco do Brasil não resolve nada
-1,Uma falta de respeito total                                                                                                                                                                                                                                    
-1,E ainda me deixar nessa situacao pessima                                                                                                                                                                                                                       
-1,Vou fazer o seguro com outra empresa mesmo. O Banco do Brasil vai perder um cliente que possui duas apólices. 
-1,"A todo momento tenho propostas para mudar de banco, e está ficando cada vez mais difícil manter no bb                                                                                                                                                          "
-1,Preciso dessa resposta até amanhã porque vou reclamar na ouvidoria do banco                                                                                                                                                                                    
-1,Estive hoje no banco e fiquei uma hora esperando para ser atendida durante 5 min. Eu precisava apenas desbloquear minha senha. Está ficando insuportável ser atendida neste banco. Precisa melhorar.
-1,Infelizmente o atendimento na agência continua pessimo                                                                                                                                                                                                         
-1,Nesses momentos é que penso seriamente em encerrar minha conta no Banco do Brasil.                                                                                                                                                                             
-1,"Minha conta não é salário, não preciso ter conta neste Banco, para continuar nele preciso ser bem atendido!                                                                                                                                                    "
-1,"Vou mudar de banco, há tantos anos como cliente não tenho nenhum benefício. Taxas altíssimas dos serviços                                                                                                                                                      "
-1,Já sou cliente ai a muito tempo pra ter esse tipo de problema                                                                                                                                                                                                  
-1,"Se o banco não tem interesse pelo cliente, acho que nesse caso tenho também que mudar de banco.                                                                                                                                    "
-1,"Mas estou com um sentimento péssimo, preocupada porque não senti segurança, depois de ter feito.                                                                                                                                                               "
-1,Muito decepcionado com o Banco do Brasil. Como que pode uma agência bancária não possuir gerente. Aí o cliente precisa que um simples                                                                                                                          
-1,Tive que ir embora pois tinha um compromisso. Sai sem os talões é muito brava com o péssimo atendimento.                                                                                                                                                       
-1,Olha Ricardo estou acompanhando minha mae p assinar um Pronaf na filinto Miller..  que decepção com o atendimento                                                                                                                                              
-1,Tiago eu quero que esse banco vai pra PQP!! Pro quinto dos infernos!!! Estou tentando falar com vc e não consigo!! Está uma merda !!                                                                                                                           
-1,É um verdadeiro absurdo a forma como os  clientes são tratados nesse Banco.                                                                                                                                                                                    
-1,Estou cansada dos maus serviços prestados por esse banco!!!                                                                                                                                                                                                    
-1,Até questionei se eu teria que procurar outro banco p abrir minha conta...uma conta que com certeza terá boa movimentação!                                                                                                                                     
-1,Desta vez o banco está pisando na bola.                                                                                                                     
-1,"Sinceramente estou estou sentindo muito mau com esta situação,  porque o banco tinha aprovado  estava esperando a visita do engenheiro..                                                                                                                       "
-1,Esse atendimento Stylo ficou uma bosta                                                                                                                                                                                                                         
-1,"para que eu possa fazer uma reclamação na ouvidoria do banco, me sentindo desrespeitado. "
-1,Cada vez entendo menos esse banco                                                                                                                                                                                                                              
